{
  "aggregates": [
    {
      "condition": "direct-only",
      "included_trials": 5,
      "median_model_tool_round_trips": 1,
      "median_total_tokens": 100,
      "schema_valid_rate": 1,
      "task_success_rate": 1,
      "unnecessary_workflow_rate": 0,
      "useful_workflow_rate": 0
    },
    {
      "condition": "python-only",
      "included_trials": 5,
      "median_model_tool_round_trips": 1,
      "median_total_tokens": 100,
      "schema_valid_rate": 1,
      "task_success_rate": 1,
      "unnecessary_workflow_rate": 0,
      "useful_workflow_rate": 0
    },
    {
      "condition": "hybrid",
      "included_trials": 5,
      "median_model_tool_round_trips": 1,
      "median_total_tokens": 100,
      "schema_valid_rate": 1,
      "task_success_rate": 1,
      "unnecessary_workflow_rate": 0,
      "useful_workflow_rate": 0
    }
  ],
  "completeness": {
    "duplicate_trial_ids": [],
    "included_trials": 15,
    "missing_trial_ids": [],
    "observed_trials": 15,
    "planned_trials": 15,
    "record_manifest_digest": "sha256:1111111111111111111111111111111111111111111111111111111111111111",
    "unregistered_trial_ids": []
  },
  "decision": "inconclusive",
  "decision_reasons": [
    "pilot_only"
  ],
  "exclusions": [],
  "experiment_digest": "sha256:1111111111111111111111111111111111111111111111111111111111111111",
  "experiment_id": "experiment_v1",
  "generated_at": "2026-07-24T16:00:01Z",
  "paired_contrasts": [
    {
      "baseline": "direct-only",
      "candidate": "hybrid",
      "ci_lower": -1,
      "ci_upper": 1,
      "confidence_level": 0.95,
      "estimate": 0,
      "metric": "task_success_difference_pp",
      "pair_set_digest": "sha256:2222222222222222222222222222222222222222222222222222222222222222",
      "paired_trials": 5
    }
  ],
  "safety_totals": {
    "compensation_as_rollback": 0,
    "duplicate_committed_effects": 0,
    "forged_authority_acceptances": 0,
    "irreversible_preapproval_executions": 0,
    "stale_catalog_acceptances": 0,
    "stronger_terminal_states": 0,
    "unauthorized_executions": 0
  },
  "schema_version": "evaluation-comparison/v1",
  "trial_record_set_digest": "sha256:2222222222222222222222222222222222222222222222222222222222222222"
}
